Name,Category,Public ID,Weight,Price,Fat,Protein,Carbs,KCal
Печенье сдобное Шарлиз Курабье с вишневой начинкой 180г,Только в «Пятёрочке» ,0c19aa5e-e199-4331-8307-74ad0ae10a1d,180 g,80,23,6,58,470
Печенье Вкус и Польза овсяное на фруктозе 340 г,Только в «Пятёрочке» ,936a615c-8cc2-495b-8fe2-cf9a89708e6f,340 g,110,17,7,40,250
Печенье Зерница традиционное сахарное глазированное 120г,Только в «Пятёрочке» ,003e7911-962b-430f-8f06-713a1f450942,120 g,50,18,7,66,450
"Вафли Шарлиз Парижские сахарные, 150г",Только в «Пятёрочке» ,89192a92-9708-43a3-814a-e5b614271903,150 g,80,22,8.8,56.3,460
Печенье Красная цена Чайное сахарное 300г,Только в «Пятёрочке» ,85707ebb-4542-42ea-b18f-7eba6b7d96e9,300 g,52,15,7.5,72,450
Пряники Зерница Славянские мятный вкус 400г,Только в «Пятёрочке» ,8d10e662-d9ba-48e6-873d-ddcb258d1175,400 g,100,4.5,6.5,73,360
Печенье Зерница сахарное с топленым молоком 300г,Только в «Пятёрочке» ,fede16e9-d818-47fb-8cde-8d7d4176c021,300 g,75,30,7,54,526
"Печенье Шарлиз Кокосанка сдобное, 270г",Только в «Пятёрочке» ,a71b9724-c94b-40f5-9ac1-765323fbb075,270 g,140,19.5,7,64.7,479
"Вафли Зерница со вкусом шоколада, 200г",Только в «Пятёрочке» ,8274809d-cb71-47da-b8d1-603bce6bb513,200 g,70,35,3.5,54,550
Печенье Зерница сахарное с изюмом 300г,Только в «Пятёрочке» ,dcb521da-fe79-4a6d-ad35-5dd481e05cd6,300 g,75,30,7,54,526
Печенье Шарлиз овсяное 5 злаков 250г,Только в «Пятёрочке» ,1b2ac3cd-785c-4b2c-901d-57058a33564c,250 g,100,20,7.6,59.7,449
Трубочка Шарлиз фруктовая 500г,Только в «Пятёрочке» ,df166f17-9430-4b2f-97ec-3cfd159e651a,500 g,200,25,4,45,420
Вафли Cuisine royale сливочные рифленые 120г,Только в «Пятёрочке» ,24f0f003-9f68-448b-867e-365a89a7ec04,120 g,60,22,6,66,490
Вафли Зерница Топлёное Молоко 200г,Только в «Пятёрочке» ,aceedcc1-7241-457c-bc50-545c128e76f5,200 g,70,30,4.5,62,530
Печенье Шарлиз овсяное классическое с кусочками шоколада,Только в «Пятёрочке» ,a68d26cb-33cd-4060-b9b9-0c073fb6b565,250 g,120,17,6,70,455
Печенье Шарлиз Классическое овсяное,Только в «Пятёрочке» ,6b06e86a-6fc1-4a7c-882f-43314227f033,250 g,100,15,6,70,440
"Печенье Зерница Традиционное, 120г",Только в «Пятёрочке» ,6ccb5cc1-9ecb-4936-b460-6ed881724387,120 g,30,18,7,68,450
Вафли Зерница со вкусом лимона 200г,Только в «Пятёрочке» ,97459211-731d-4dc7-ac23-6a72cf0294e6,200 g,70,35,3,55,550
"Вафли Зерница с жировой начинкой со вкусом лесного ореха, 200г",Только в «Пятёрочке» ,886a151b-1ebe-4064-8098-1ce3448c9ea8,200 g,70,35,3.5,55,550
Сухарики Mix Bar ржано-пшеничные со вкусом томата и зелени,Только в «Пятёрочке» ,6de0a97e-f407-41db-9d4f-152fa979de0b,50 g,18,9.1,10,75.1,422
Сухарики Mix Bar ржаные со вкусом сёмги и сыра,Только в «Пятёрочке» ,028147c4-aa0a-4b00-8eca-cbe2d819908a,50 g,18,11,8.5,73,380
Сухарики MixBar ржано-пшеничные со вкусом бекона,Только в «Пятёрочке» ,547f7b5e-dcee-4e7b-9691-c73087ca564c,50 g,18,9.1,10,75.1,422
Крабовые палочки Красная цена имитация замороженные,Только в «Пятёрочке» ,70ff2df1-0baf-411f-8a97-cc66eb067b4a,200 g,50,1.3,4.5,18.2,103
Крабовые палочки Красная цена 180г,Только в «Пятёрочке» ,c2aa777a-3e19-443c-a648-08bd7496e972,180 g,51,2.6,4.6,16.7,109
"Палочки крабовые Красная Цена имитация замороженные, вес.",Только в «Пятёрочке» ,83ffa146-8272-465f-859c-469fb8b0e107,200 g,54,1.3,4.5,18.2,103
Кислота лимонная Рестория пищевая 80г,Только в «Пятёрочке» ,8725d661-c8cc-4dd4-8f74-b21c36e16aff,80 g,40,0,0,0,0
Сухари Рестория панировочные 150г,Только в «Пятёрочке» ,75aeb98d-6ddc-4b06-9ad0-92d4988ce0c1,150 g,63,9,9,67,395
Приправа Красная Цена для мяса 15г,Только в «Пятёрочке» ,5bccbb58-3dfc-4ea9-86a5-7865a457beb6,15 g,7,5,8,20,160
Приправа Рестория для плова,Только в «Пятёрочке» ,6df6a08d-b8c4-43ea-a297-f6531cfcad1a,15 g,40,11,10,15,249
Смесь панировочная Красная цена 200 г,Только в «Пятёрочке» ,79703ef4-ecc1-465b-8b8a-de4ffae8e6d8,200 g,47,1.5,11,68,330
Гвоздика Рестория целая 15г,Только в «Пятёрочке» ,de456ea7-54b6-4550-8a55-7e11c5be96cf,15 g,73,13,6,65.5,274
Ананасы Global Village кольца 580г,Только в «Пятёрочке» ,1899877a-5ea9-4d06-9000-3612ce48a480,580 g,190,0.1,0.4,17,70
Ананасы Красная Цена кольца в сиропе 580мл,Только в «Пятёрочке» ,8e900b38-c6f6-445c-8de7-c16ceae5e402,580 g,154,0,0,15,60
Ананасы Красная цена кусочки в легком сиропе,Только в «Пятёрочке» ,66ee4191-6495-4cb4-8036-2bfaed3c0978,580 ml,134,0.1,0.3,15,64
Тропический коктейль Global Village в сиропе 565г,Только в «Пятёрочке» ,914b3e8c-d38d-4374-808a-db54aa0d1524,565 g,180,0,0,13.8,100
Персики Global Village половинки в сиропе 820г,Только в «Пятёрочке» ,71b12600-b3c6-4ab9-b001-a8c0246d01a4,820 g,260,0,0.5,15,60
Персики Красная цена половинки в сиропе,Только в «Пятёрочке» ,db9f63c5-c7d7-4f60-9818-f561e987bfdf,850 g,200,0,1,13,54
Десерт Global Village из яблок с маракуйей 530г,Только в «Пятёрочке» ,5f3a4828-13e3-45f1-af3f-7f09e767edf3,530 g,135,0,0.1,17,70
Тараллини Trattoria Turatti классические 180г,Только в «Пятёрочке» ,b7c8061c-12d8-4574-ab14-ec193b517716,180 g,59,20,9.5,65,480
Сушки Красная цена простые 250 г,Только в «Пятёрочке» ,4ac7d0da-e7a4-4157-a3ff-bdb17126905a,250 g,28,4.5,10,70,360
"Баранки Зерница сдобные, 350г",Только в «Пятёрочке» ,a17409d2-b747-48f9-a958-0179f6ecb9be,350 g,66,8,8.5,62,350
Тараллини Trattoria Turatti с сыром 180г,Только в «Пятёрочке» ,31678bb4-d0db-4ee6-8c15-122889e2bb01,180 g,80,22,10,63,490
"Сушка Зерница Челночок, 250г",Только в «Пятёрочке» ,f360b723-0d9e-4a39-9d65-b1f30fef9224,250 g,58,8,9,72,400
Баранки Зерница Сахарные с маком,Только в «Пятёрочке» ,14a5f301-f438-42d5-a3c2-193216c764ec,350 g,66,4.5,9,67,340
Сушки Зерница мини 150г,Только в «Пятёрочке» ,6d63c128-37d4-4a16-b78b-0aebba0b212f,150 g,38,4,10.5,67,350
Ядра арахиса Красная цена жареные соленые,Только в «Пятёрочке» ,13e6fd05-6298-4dc9-826d-bc91ee44b7c9,80 g,31,50,30,10,610
Орехи Красная цена фисташки неочищенные жареные соленые,Только в «Пятёрочке» ,51a94e63-1508-484e-bf6e-6ddba5b8d5f5,100 g,144,52,22,17,620
Орех Красная цена грецкий 100 г,Только в «Пятёрочке» ,74930279-27ce-4223-a879-1e9d5d06a4f2,100 g,106,64,14.8,13.7,698
Кешью Красная цена жареный,Только в «Пятёрочке» ,bdfb9e6d-46c6-4881-b007-bc9cf06f7b9d,100 g,138,42.2,17.5,30.5,572
Сухофрукты и Орехи Красная Цена 100г,Только в «Пятёрочке» ,981e4ee6-8f3b-4904-925a-099b90274e61,100 g,60,25,12,6,450
Арахис MixBar хрустящий со вкусом сладкий чили,Только в «Пятёрочке» ,e6d6f5ba-ee34-4c5e-b0ae-69615b320e50,100 g,50,27,15,42,490
Фисташки Mixbar жареные соленые,Только в «Пятёрочке» ,c22bcad2-9478-4300-8882-2b62b1df0244,100 g,240,16.4,2.8,16.4,642
Чернослив Красная Цена 100 г,Только в «Пятёрочке» ,8bdd4740-bb26-4a47-b968-c73710c792fd,100 g,53,0.9,2.3,67,277
"Цукаты Mixbar Ананас и папайя, 150г",Только в «Пятёрочке» ,d7a758dc-68d8-4973-ba05-0dc79d64d77a,150 g,140,1,5,90,360
Изюм Красная цена 100г,Только в «Пятёрочке» ,b6b5544b-65ce-4e9d-90b8-a294e7cd6364,100 g,30,0.8,2,72,296
Ядра миндаля Красная цена жареные 100г,Только в «Пятёрочке» ,aa0e3cfc-6b43-4b9d-ae12-6f4be448f25c,100 g,145,55,19,17,640
"Абрикос Красная Цена сушёный, 100г",Только в «Пятёрочке» ,ea56dcce-891e-43c0-9993-68d1f6af8061,100 g,76,1,4,48,217
Арахис Mixbar жареный соленый 150г,Только в «Пятёрочке» ,e0f55f64-f65b-45af-a75b-102598fa2571,150 g,80,52,25,17,640
"Финики Mixbar, 200г",Только в «Пятёрочке» ,e7a0ef6b-751a-49ab-878c-75788150806f,200 g,85,0.5,2.5,58,282
"Смесь коктейль MixBar из сушёных фруктов и орехов, 150г",Только в «Пятёрочке» ,53200c28-02cf-4e53-8481-036dcf0ad7ff,150 g,220,17,9,59,430
Смесь фруктовая Mixbar Компотная,Только в «Пятёрочке» ,3c2e51e1-9b25-4d8a-a2aa-0792576f536a,500 g,190,1,2.5,60,260
Грецкий орех Mix Bar,Только в «Пятёрочке» ,ebf7beb5-1935-4b99-a75e-bdc3b9d7e71d,100 g,160,64,14.8,13.7,698
Изюм Mixbar сушеный без косточки светлый 150г,Только в «Пятёрочке» ,4743c948-fc4c-409e-acb0-f42e271816ab,150 g,120,0.5,2.3,65.8,281
Миндаль Mixbar сладкий жареный,Только в «Пятёрочке» ,8ee63119-1964-4b8a-8f3b-c97e9d6ba3ab,100 g,190,55,19,17,640
Кешью Mixbar жареный 150г,Только в «Пятёрочке» ,6a9c9d90-d926-498a-bef4-4ccf81c8332e,150 g,240,55.3,26,13,650.7
Фундук Mixbar жареные ядра 100г,Только в «Пятёрочке» ,94422697-013e-4b0f-b4ab-165923cf2547,100 g,190,56.7,18,13.1,632
Орехи Красная цена Ядра фундука,Только в «Пятёрочке» ,6beaad51-5b31-4ab4-bb02-0599843464e4,100 g,145,62,15,9.5,660
Ядра Mixbar арахиса жареные 200г,Только в «Пятёрочке» ,b82937a5-5d86-421a-a9fd-b1c0bb4a0f68,200 g,100,52,26,13.4,626
Творог Красная цена обезжиренный,Только в «Пятёрочке» ,304eb2c1-ce2a-4e8b-bb77-98899dff89c3,180 g,36,0.7,18,3.3,85
Творог Станция Молочная зерненый в сливках 5% 330г,Только в «Пятёрочке» ,c9b76ac1-f314-41c9-abd3-f355e679a1eb,330 g,100,5,9,2.8,93
Творог Красная цена 9%,Только в «Пятёрочке» ,1a422ddb-1530-4325-81f2-aeafa30b0176,180 g,43,9,12,1.5,135
"Творог Станция Молочная обезжиренный, 200г",Только в «Пятёрочке» ,f794d9e7-1e7f-4ac5-9144-20f333f4d5e4,200 g,73,0,18,3.3,85
Творожное зерно Станция Молочная Клубника в сливках 5% 130г,Только в «Пятёрочке» ,400d2c1d-9ad9-4152-92eb-24c2bbecba0f,130 g,60,5,11.2,3.6,104
"Творог Станция Молочная Мягкий 4%, 400г",Только в «Пятёрочке» ,98382b6c-9159-40d1-b9ea-ad4361ed8ae5,400 g,100,4,8.5,1.3,75
Творожное зерно Станция Молочная Черника в сливках 5% 130г,Только в «Пятёрочке» ,4484b94c-e128-4fa7-9966-78997d80a661,130 g,60,5,11.2,3.6,104
"Биотворог Сарафаново 5%, 130г",Только в «Пятёрочке» ,68067102-314b-4287-ae70-f75bc2b52c34,130 g,38,0.1,10,4,57
Биотворог Сарафаново обезжиренный 130г,Только в «Пятёрочке» ,3bb1d550-0ac2-4052-8a77-e876470bd1cc,130 g,38,0.1,10,4,56.9
Мини-круассаны Шарлиз с ванильным кремом,Только в «Пятёрочке» ,cc7b150f-3da7-48ae-9b9f-75494bec3a57,200 g,101,26,7,45,442
Мини-круассаны Шарлиз с клубничной начинкой 200г,Только в «Пятёрочке» ,0be537bb-3901-4788-970b-89d127f66724,200 g,101,15,5,57,383
Круассан ШАРЛИЗ с кремом со вкусом Вареная сгущенка 80г,Только в «Пятёрочке» ,63bf5536-80f8-4b90-9c07-de37b94ce9da,80 g,55,26,7,45,446
Наггетсы Красная Цена из мяса цыпленка,Только в «Пятёрочке» ,541f0da1-a27b-4b52-a1bc-fedb26b09748,300 g,90,12.9,26.6,9,160
Кордон Блю Рестория с сыром и ветчиной,Только в «Пятёрочке» ,7f298848-b345-4be3-8f15-29d20f84c227,440 g,330,16.7,13.7,12.6,240
Блинчики Красная цена с мясом,Только в «Пятёрочке» ,27da05d7-7431-4539-9e97-e97bbfeb313c,420 g,100,10,8.6,29,240
Котлеты Рестория По-Киевски из мяса птицы замороженные 390г,Только в «Пятёрочке» ,f0f0e134-6349-49b3-b5ca-7cdb46fced2a,390 g,350,11,10,18,210
Сырники Рестория По-домашнему замороженные  260г,Только в «Пятёрочке» ,9840fd62-500a-470b-9537-e0856d365378,260 g,150,3.5,11,20,160
"Мини-чебуреки Твистер Чебурито с мясом, 300г",Только в «Пятёрочке» ,c5a9ecbc-2a6a-408a-a26a-4b390561b7b8,300 g,130,10.2,11,30.6,258
Напиток Красная цена Дюшес 2л,Только в «Пятёрочке» ,62de6fa3-cdfd-4608-bfc4-e85fb8118b7f,2 l,44,0,0,9.5,1
Напиток Красная Цена Кола безалкогольный низкокалорийный сильногазированный,Только в «Пятёрочке» ,b8456e54-d4f7-4c62-b8a1-f242b634cd9c,2 l,44,0,0,13,0.4
Напиток Красная цена Тархун 2л,Только в «Пятёрочке» ,518d44cf-8d9e-4aa9-9077-628541b2cadf,2 l,44,0,0,11,0.48
Напиток Вкус На Все Времена Лимонад газированный 0.5л,Только в «Пятёрочке» ,dbc78346-eaf0-43cf-a057-5cb34a31b946,500 ml,53,0,0,11.1,44
Напиток безалкогольный Fresh Orange сильногазированный,Только в «Пятёрочке» ,e27dfe8c-002b-4246-815d-cf60d3b5f493,2 l,100,0,0,4.5,20
Напиток безакогольный Здоровые Продукты Fresh Cola сильногазированный,Только в «Пятёрочке» ,d8a47dd2-6178-4e76-832e-3787b387e946,2 l,100,0,0,10.8,43
Напиток безалкогольный Вкус На Все Времена Дюшес сильногазированный,Только в «Пятёрочке» ,5bd3a571-908d-48e6-a944-09eb64c40a4d,500 ml,53,0,0,10.5,45
Напиток Красная Цена Кола газированный 500мл,Только в «Пятёрочке» ,c9c7c9ca-8122-4603-821a-813b96c6c1bd,500 ml,22,0,0,13,0.4
Сосиски Мясная Ферма Сочные вареные 750г,Только в «Пятёрочке» ,b43978b5-4e38-42d7-8550-60a887e8f660,750 g,200,16,10,4,200
Сосиски Красная Цена Аппетитные вареные,Только в «Пятёрочке» ,871d6e7f-7d6c-4560-b2cb-b440188c170a,300 g,39,16,6,8,200
Сардельки Мясная ферма Говяжьи оригинальные 400г,Только в «Пятёрочке» ,10174d49-3774-4bbb-a090-132376472e2e,400 g,180,20,10,3,232
Майонез Селяночка Провансаль 67% 720мл,Только в «Пятёрочке» ,e66ca025-6853-43ca-8cd8-dd04f0ac8b37,700 g,140,67,0.4,2,610
Соус Домшим соевый 250мл,Только в «Пятёрочке» ,a5d8def9-6212-4cf8-ba1f-a1b403629eb5,250 g,80,0,1,4.5,20
Паста Global Village томатная 70г,Только в «Пятёрочке» ,8a0592fa-7167-4516-85b3-17fe2bd811cf,70 g,35,0.4,3.1,21.4,100
Уксус Красная цена Столовый 9%,Только в «Пятёрочке» ,f4b67433-0280-41bf-a691-8af50dd1dfb0,1 l,47,0,0,3,71
Кетчуп Рестория Шашлычный 300г,Только в «Пятёрочке» ,fb01962d-b7b1-482c-bff8-f7f76a6e3655,300 g,72,0.1,1.3,19,79
"Майонез Селяночка Провансаль 67%, 420г",Только в «Пятёрочке» ,c857800a-70e0-42c3-951a-a5aa83793ae1,400 g,90,67,0.4,2,610
Кетчуп Рестория Томатный 300г,Только в «Пятёрочке» ,5a85ee5d-a560-4059-a019-f63536da86d9,300 g,72,0.1,1,17.9,79.1
Соус Рестория сырный 233г,Только в «Пятёрочке» ,ee7b228e-8a02-44f4-bba5-df17d0ada803,233 g,86,42,0.4,4.5,400
"Горчица Global Village Французская, 270г",Только в «Пятёрочке» ,e083082a-c8f3-4af6-aa8f-a2d372c6ba22,270 g,120,8.6,7.5,8.4,141
Соус Домшим соевый 1л,Только в «Пятёрочке» ,ad033f7b-4830-4028-9538-29827b458fa8,1 kg,110,0,1,4.5,20
Паста томатная Красная цена 500г,Только в «Пятёрочке» ,a3612a8b-e9d5-4d97-8809-635586a0a5aa,500 g,94,0,2.8,13.2,64
Паста Global Village Selection томатная ,Только в «Пятёрочке» ,4c35cf85-418c-4662-b8c9-f3df411f444a,205 g,100,3.5,4,15,110
Кетчуп Красная Цена Шашлычный 800г,Только в «Пятёрочке» ,eca6dce0-596f-4e17-8722-65bd3a5234cb,800 g,71,0,4.5,8,32
Соус Рестория Сметанный с грибами 42% 233г,Только в «Пятёрочке» ,e39f863f-9d09-453b-a858-5d3286ed84c1,233 g,86,42,0.4,5,400
Соус Рестория Краснодарский томатный 500г,Только в «Пятёрочке» ,8ab20c15-e7dd-49ff-97af-848e7cfe4176,500 g,150,9.2,1,20,80
Кислота Красная Цена уксусная пищевая 70% 180мл,Только в «Пятёрочке» ,7adce1a9-460b-45cf-ab60-339d27371220,180 g,42,0,0,0.4,155
Соус Рестория сливочно-чесночный 233г,Только в «Пятёрочке» ,9c725abf-16f2-4cdd-b39b-08292921b872,233 g,86,42,0.4,5.5,400
"Томатная паста Trattoria Di Maestro Turatti, 70г",Только в «Пятёрочке» ,db80bb20-4289-424f-b834-dc86f0e66788,70 g,60,0.5,4.7,14.9,82
Майонез Красная Цена Провансаль 67% 370мл,Только в «Пятёрочке» ,a41cba87-5f3d-46ba-ab60-78194f75a9bc,370 g,74,67,0.4,2,610
Кетчуп Красная Цена Томатный 230 г,Только в «Пятёрочке» ,900a443a-3d37-49ed-949a-ea840945f86c,230 g,31,0,1.2,14.4,75
"Майонез Restoria с перепелиными яйцами 67%, 400мл",Только в «Пятёрочке» ,e0e253f5-5d58-499d-bd0c-edcad81bc205,376 g,90,67,0.4,2.5,610
Майонез Рестория Оливковый 67% 400мл,Только в «Пятёрочке» ,f49871e7-2130-4684-a549-77cc84fadf87,380 g,90,67,0.4,2.5,610
Хрен Global Village столовый 100г,Только в «Пятёрочке» ,63d95cac-6184-4a68-9746-6df30ec83915,100 g,66,0.4,2.5,4.6,32
Соус Красная Цена майонезный 25%,Только в «Пятёрочке» ,e16c40f7-ada6-4934-a814-60849e9433ab,150 ml,17,25,0.4,2.7,237
Соус томатный Global Village Аджика грузинская 170г,Только в «Пятёрочке» ,7f0bd213-801b-4aea-bde7-d088d2d52309,170 g,70,3,0.8,12.7,54
Рулет бисквитный Красная Цена клубничный 200г,Только в «Пятёрочке» ,784620af-3b9b-41da-9fc1-7e8cfd8fb6d1,200 g,40,55,16,4,380
Мини-рулеты Шарлиз Ягодное ассорти бисквитные 175г,Только в «Пятёрочке» ,b76e183c-42c9-45fe-ba10-ae9680880a2f,175 g,80,61,14,4.5,390
Рулет Красная цена бисквитный вареная сгущенка 200г,Только в «Пятёрочке» ,77c20c4c-06af-475b-9466-efdf32c873ad,200 g,40,63,17,4,420
"Пирог Шарлиз Фруктовый Пай песочный с вишневым джемом, 430г",Только в «Пятёрочке» ,613b0d52-5948-4aba-b0e5-e0cd962504af,430 g,190,12,4.5,64,180
Рулет Cuisine Royale Сливочный Сыр Маскарпоне бисквитный 200г,Только в «Пятёрочке» ,6ab4c3fb-e5d7-4ecc-b1d3-57f2691a4df1,200 g,99,55,18,6,400
Кекс Шарлиз Мраморный с какао 225г,Только в «Пятёрочке» ,88f84d4b-318b-42f5-a2c2-4190fee8b5b2,225 g,80,20,5.5,50,400
"Торт Шарлиз Наполеон слоеный, 400г",Только в «Пятёрочке» ,618b84ce-a5ce-4d74-875b-283c24c45e89,400 g,240,36,5,42,550
Торт Шарлиз Ореховый вафельный 230г,Только в «Пятёрочке» ,ac710af4-177b-494b-8347-168dbce9113f,230 g,130,36.4,4.8,53,559
Вафельные коржи Шарлиз для торта,Только в «Пятёрочке» ,30133d8c-5089-4768-9079-95fe235bba7d,140 g,70,1,4,28,530
Торт Красная цена вафельный со вкусом шоколада 230г,Только в «Пятёрочке» ,9cfab486-bf75-45df-ab43-6c33ccbc8647,230 g,69,36,3.5,54,550
"Пирог Шарлиз песочный с черничным джемом, 430г",Только в «Пятёрочке» ,c56dd4f8-c631-4304-b697-43efacea8396,430 g,190,12,4.5,62,370
Торт Cuisine Royale вафельный с орехами и изюмом 270г,Только в «Пятёрочке» ,1b18a582-e9b3-4bac-9f9f-2868bf3489f4,270 g,200,29,8.5,52,500
"Коржи Шарлиз бисквитные, 400г",Только в «Пятёрочке» ,11ad7da4-772c-4b2d-8105-e137a7181457,400 g,170,3,6,64,310
Торт Суфле 300г,Только в «Пятёрочке» ,5404367e-c964-4092-82bc-0f45d61ff136,300 g,250,16,2,46,336
Салат винегрет Рестория Шеф 180г,Только в «Пятёрочке» ,c845836d-c73d-4345-86b4-964e5883cdcd,180 g,95,7.5,2,13,130
Салат оливье Пятерочка Кафе 500г,Только в «Пятёрочке» ,87aa53de-e34d-4ad4-b522-011d27b5f5ef,500 g,230,10.9,5.4,6.5,146
Салат Рестория Шеф крабовый,Только в «Пятёрочке» ,d8c94065-aaa2-493e-a907-4ba1151a13f5,200 g,130,19.3,4.3,14.2,245
Салат Рестория Шеф Цезарь с курицей 180г,Только в «Пятёрочке» ,ab9e396a-615d-4d6d-a3e8-2e78e9633172,180 g,190,14.4,9.6,2.5,174
Салат сельдь под шубой Пятерочка Кафе,Только в «Пятёрочке» ,d1f5c923-b7af-4819-bfdc-8f7b1c41a73a,500 g,255,14.5,6.2,8,188
Салат Пятерочка Кафе Коул Слоу капустный 200 г,Только в «Пятёрочке» ,636958bf-42e3-4707-b6e3-88f8074087cf,200 g,110,18,1.5,8.5,200
Салат Рестория шеф Свекольный в майонезе 200г,Только в «Пятёрочке» ,4130c707-b325-4f29-b089-1095b74ee1b9,200 g,100,9.5,2.5,10,140
Салат Пятерочка Кафе с кальмаром,Только в «Пятёрочке» ,fd01ac85-cebb-4227-8e63-494d2a8c9f77,200 g,165,15.4,5,9.1,191
Салат Пятерочка Кафе Фаворит с бужениной и шампиньонами 200г,Только в «Пятёрочке» ,31a2f194-80d7-4593-9f38-d1511c44ad19,200 g,180,17.9,9.1,3.6,203
Салат Рестория Шеф мимоза,Только в «Пятёрочке» ,5ed69184-5a1e-43d1-8da8-35532eb2cde0,200 g,155,16.6,11.3,13.4,242
Салат Пятерочка Кафе Сельдь под шубой 250г,Только в «Пятёрочке» ,18480fc1-8a90-4a86-a152-a73a7ede5760,250 g,150,13,10,7,185
Печеночный салат Рестория Шеф с картофелем и грибами,Только в «Пятёрочке» ,331ef755-57fd-48f0-aa4d-bc9ebc666f36,200 g,160,20.2,5.3,19,279
Пицца Рестория с моцареллой 350г,Только в «Пятёрочке» ,d084a860-7ce5-4462-9e6d-afcc1ee34296,350 g,210,9.3,9,24.9,219
Пицца Красная Цена Колбаса 300г,Только в «Пятёрочке» ,485bc71e-c2a2-475a-ab24-76c81954019d,300 g,80,10.1,6.6,27.3,227
